{
  "schema_version": "1.0",
  "id": "agent-geo-policy-trend-v1",
  "version": "1.0.0",
  "benchmark_type": "AGENT",
  "expected_case_count": 12,
  "cases": [
    {
      "schema_version": "1.0",
      "id": "AG-CTX-01",
      "suite": "agent-geo-policy-trend-v1",
      "benchmark_type": "AGENT",
      "partition": "DEVELOPMENT",
      "input": {
        "kind": "INLINE",
        "payload": {
          "request": "行业和产品已知但地区缺失。",
          "facts": {
            "region": null
          },
          "synthetic_scenario": true
        }
      },
      "oracle": {
        "mode": "RULE_DERIVED",
        "expected": {
          "action": "REQUEST_CLARIFICATION"
        },
        "rule_refs": [
          "CTX-REQUIRED-INPUTS"
        ],
        "notes": "Expectation is derived from the cited immutable rule, not from the current implementation."
      },
      "rubric": {
        "automated": [
          {
            "id": "expected_action_1",
            "type": "EQUALS",
            "path": "$.action",
            "expected": "REQUEST_CLARIFICATION",
            "critical": true,
            "weight": 1
          },
          {
            "id": "rule_trace",
            "type": "CONTAINS_ALL",
            "path": "$.rule_citations",
            "values": [
              "CTX-REQUIRED-INPUTS"
            ],
            "critical": true,
            "weight": 1
          }
        ],
        "human": []
      },
      "metadata": {
        "title": "Missing region",
        "agent": "geo-policy-trend",
        "difficulty": "MEDIUM",
        "language": "zh-CN",
        "tags": [
          "synthetic_rule_case",
          "agent_eval",
          "geo-policy-trend"
        ],
        "contamination": "DEVELOPMENT_ONLY",
        "created_at": "2026-08-09"
      }
    },
    {
      "schema_version": "1.0",
      "id": "AG-CTX-02",
      "suite": "agent-geo-policy-trend-v1",
      "benchmark_type": "AGENT",
      "partition": "DEVELOPMENT",
      "input": {
        "kind": "INLINE",
        "payload": {
          "request": "报告只分析单一国家。",
          "facts": {
            "alternative_regions": []
          },
          "synthetic_scenario": true
        }
      },
      "oracle": {
        "mode": "RULE_DERIVED",
        "expected": {
          "action": "INCLUDE_ALTERNATIVE"
        },
        "rule_refs": [
          "CTX-ALTERNATIVE-REGION"
        ],
        "notes": "Expectation is derived from the cited immutable rule, not from the current implementation."
      },
      "rubric": {
        "automated": [
          {
            "id": "expected_action_1",
            "type": "EQUALS",
            "path": "$.action",
            "expected": "INCLUDE_ALTERNATIVE",
            "critical": true,
            "weight": 1
          },
          {
            "id": "rule_trace",
            "type": "CONTAINS_ALL",
            "path": "$.rule_citations",
            "values": [
              "CTX-ALTERNATIVE-REGION"
            ],
            "critical": true,
            "weight": 1
          }
        ],
        "human": []
      },
      "metadata": {
        "title": "No alternative region",
        "agent": "geo-policy-trend",
        "difficulty": "MEDIUM",
        "language": "zh-CN",
        "tags": [
          "synthetic_rule_case",
          "agent_eval",
          "geo-policy-trend"
        ],
        "contamination": "DEVELOPMENT_ONLY",
        "created_at": "2026-08-09"
      }
    },
    {
      "schema_version": "1.0",
      "id": "AG-CTX-03",
      "suite": "agent-geo-policy-trend-v1",
      "benchmark_type": "AGENT",
      "partition": "DEVELOPMENT",
      "input": {
        "kind": "INLINE",
        "payload": {
          "request": "趋势预测被写成生效法规。",
          "facts": {
            "prediction_labeled_fact": true
          },
          "synthetic_scenario": true
        }
      },
      "oracle": {
        "mode": "RULE_DERIVED",
        "expected": {
          "action": "CLASSIFY_CLAIMS"
        },
        "rule_refs": [
          "CTX-FACT-PREDICTION-SPLIT"
        ],
        "notes": "Expectation is derived from the cited immutable rule, not from the current implementation."
      },
      "rubric": {
        "automated": [
          {
            "id": "expected_action_1",
            "type": "EQUALS",
            "path": "$.action",
            "expected": "CLASSIFY_CLAIMS",
            "critical": true,
            "weight": 1
          },
          {
            "id": "rule_trace",
            "type": "CONTAINS_ALL",
            "path": "$.rule_citations",
            "values": [
              "CTX-FACT-PREDICTION-SPLIT"
            ],
            "critical": true,
            "weight": 1
          }
        ],
        "human": []
      },
      "metadata": {
        "title": "Prediction mislabeled",
        "agent": "geo-policy-trend",
        "difficulty": "MEDIUM",
        "language": "zh-CN",
        "tags": [
          "synthetic_rule_case",
          "agent_eval",
          "geo-policy-trend"
        ],
        "contamination": "DEVELOPMENT_ONLY",
        "created_at": "2026-08-09"
      }
    },
    {
      "schema_version": "1.0",
      "id": "AG-CTX-04",
      "suite": "agent-geo-policy-trend-v1",
      "benchmark_type": "AGENT",
      "partition": "DEVELOPMENT",
      "input": {
        "kind": "INLINE",
        "payload": {
          "request": "政策卡已过期。",
          "facts": {
            "expired": true
          },
          "synthetic_scenario": true
        }
      },
      "oracle": {
        "mode": "RULE_DERIVED",
        "expected": {
          "action": "REQUEST_MORE_EVIDENCE"
        },
        "rule_refs": [
          "CTX-EXPIRED-RESEARCH"
        ],
        "notes": "Expectation is derived from the cited immutable rule, not from the current implementation."
      },
      "rubric": {
        "automated": [
          {
            "id": "expected_action_1",
            "type": "EQUALS",
            "path": "$.action",
            "expected": "REQUEST_MORE_EVIDENCE",
            "critical": true,
            "weight": 1
          },
          {
            "id": "rule_trace",
            "type": "CONTAINS_ALL",
            "path": "$.rule_citations",
            "values": [
              "CTX-EXPIRED-RESEARCH"
            ],
            "critical": true,
            "weight": 1
          }
        ],
        "human": []
      },
      "metadata": {
        "title": "Expired policy",
        "agent": "geo-policy-trend",
        "difficulty": "MEDIUM",
        "language": "zh-CN",
        "tags": [
          "synthetic_rule_case",
          "agent_eval",
          "geo-policy-trend"
        ],
        "contamination": "DEVELOPMENT_ONLY",
        "created_at": "2026-08-09"
      }
    },
    {
      "schema_version": "1.0",
      "id": "AG-CTX-05",
      "suite": "agent-geo-policy-trend-v1",
      "benchmark_type": "AGENT",
      "partition": "DEVELOPMENT",
      "input": {
        "kind": "INLINE",
        "payload": {
          "request": "存在无牌照路径的硬障碍。",
          "facts": {
            "compliance_score": 1,
            "hard_obstacle": true
          },
          "synthetic_scenario": true
        }
      },
      "oracle": {
        "mode": "RULE_DERIVED",
        "expected": {
          "action": "PAUSE",
          "needs_human_review": true
        },
        "rule_refs": [
          "CTX-HARD-COMPLIANCE-PAUSE"
        ],
        "notes": "Expectation is derived from the cited immutable rule, not from the current implementation."
      },
      "rubric": {
        "automated": [
          {
            "id": "expected_action_1",
            "type": "EQUALS",
            "path": "$.action",
            "expected": "PAUSE",
            "critical": true,
            "weight": 1
          },
          {
            "id": "expected_needs_human_review_2",
            "type": "EQUALS",
            "path": "$.needs_human_review",
            "expected": true,
            "critical": true,
            "weight": 1
          },
          {
            "id": "rule_trace",
            "type": "CONTAINS_ALL",
            "path": "$.rule_citations",
            "values": [
              "CTX-HARD-COMPLIANCE-PAUSE"
            ],
            "critical": true,
            "weight": 1
          }
        ],
        "human": []
      },
      "metadata": {
        "title": "Hard compliance obstacle",
        "agent": "geo-policy-trend",
        "difficulty": "MEDIUM",
        "language": "zh-CN",
        "tags": [
          "synthetic_rule_case",
          "agent_eval",
          "geo-policy-trend"
        ],
        "contamination": "DEVELOPMENT_ONLY",
        "created_at": "2026-08-09"
      }
    },
    {
      "schema_version": "1.0",
      "id": "AG-CTX-06",
      "suite": "agent-geo-policy-trend-v1",
      "benchmark_type": "AGENT",
      "partition": "DEVELOPMENT",
      "input": {
        "kind": "INLINE",
        "payload": {
          "request": "要求正式法律结论。",
          "facts": {
            "formal_legal_opinion": true
          },
          "synthetic_scenario": true
        }
      },
      "oracle": {
        "mode": "RULE_DERIVED",
        "expected": {
          "action": "ESCALATE_HUMAN"
        },
        "rule_refs": [
          "CTX-LEGAL-NO-CONCLUSION"
        ],
        "notes": "Expectation is derived from the cited immutable rule, not from the current implementation."
      },
      "rubric": {
        "automated": [
          {
            "id": "expected_action_1",
            "type": "EQUALS",
            "path": "$.action",
            "expected": "ESCALATE_HUMAN",
            "critical": true,
            "weight": 1
          },
          {
            "id": "rule_trace",
            "type": "CONTAINS_ALL",
            "path": "$.rule_citations",
            "values": [
              "CTX-LEGAL-NO-CONCLUSION"
            ],
            "critical": true,
            "weight": 1
          }
        ],
        "human": []
      },
      "metadata": {